data_id,iso,event_id_cnty,event_id_no_cnty,event_date,year,time_precision,event_type,sub_event_type,actor1,assoc_actor_1,inter1,actor2,assoc_actor_2,inter2,interaction,region,country,admin1,admin2,admin3,location,latitude,longitude,geo_precision,source,source_scale,notes,fatalities,timestamp,iso3
6713144,729,SUD13531,13531,"19 December 2019",2019,1,Protests,"Peaceful protest","Protesters (Sudan)",,6,,,0,60,"Northern Africa",Sudan,Khartoum,"Umm Badda",,Omdurman,15.6447,32.4549,1,"Radio Dabanga; Sudan Tribune",National,"On 19 December 2019, demonstrators marched in Greater Khartoum (three events coded in Khartoum, Omdurman and Khartoum North) to commemorate the uprising that began in December 2018, calling for the goals of the revolution to be fulfilled, and justice for those killed in the course of the uprising. [size=thousands]",0,1578512390,SDN
6709305,300,GRC1360,1360,"19 December 2019",2019,1,Protests,"Peaceful protest","Protesters (Greece)",,6,,,0,60,Europe,Greece,Attica,Athens,"Central Athens","Athens-Central Athens",37.9685,23.7585,1,"in.gr; To Vima",National,"On 19 December, a multitude of members of anti-establishment groups and supporters of the occupation of buildings rallied in Exarchia to protest against the police operation for the evacuation of three occupied buildings in Koukaki and against police violence. MAT riot police were present. [size=a multitude]",0,1578510533,GRC
6713145,729,SUD13532,13532,"19 December 2019",2019,1,Protests,"Peaceful protest","Protesters (Sudan)",,6,,,0,60,"Northern Africa",Sudan,"Red Sea","Port Sudan",,"Port Sudan",19.5896,37.2152,1,"Radio Dabanga; Sudan Tribune",National,"On 19 December 2019, demonstrators marched in Port Sudan (Red Sea state) to commemorate the uprising that began in December 2018, calling for the goals of the revolution to be fulfilled, and justice for those killed in the course of the uprising. [size=thousands]",0,1578512390,SDN
6709306,300,GRC1361,1361,"19 December 2019",2019,1,Riots,"Violent demonstration","Rioters (Greece)","PAME: All-Workers Militant Front; Labour Group (Greece)",5,"Police Forces of Greece (2019-) Units for the Reinstatement of Order",,1,15,Europe,Greece,"Central Macedonia",Thessaloniki,Thessaloniki,Thessaloniki,40.6436,22.9309,1,"MAKEDONIA; ThessNews; I Avgi",Subnational-National,"On 19 December, members of PAME rallied in central Thessaloniki outside a branch of the National Bank to prevent the auction of a first home residence. MAT riot police prevented them from entering the building and made limited use of tear gas. A pensioner was reportedly injured. [size=no report]",0,1578510533,GRC
6713146,729,SUD13533,13533,"19 December 2019",2019,1,Protests,"Peaceful protest","Protesters (Sudan)",,6,,,0,60,"Northern Africa",Sudan,Sennar,Sennar,,Sennar,13.5422,33.6172,1,"Sudan Tribune; Radio Dabanga",National,"On 19 December 2019, demonstrators marched in Sennar (Sennar state) to commemorate the uprising that began in December 2018, calling for the goals of the revolution to be fulfilled, and justice for those killed in the course of the uprising. [size=thousands]",0,1578512390,SDN
6713402,12,ALG7885,7885,"19 December 2019",2019,1,Protests,"Peaceful protest","Protesters (Algeria)",,6,,,0,60,"Northern Africa",Algeria,Djelfa,Djelfa,,Djelfa,34.6667,3.25,1,"Djelfa Info",Subnational,"On 19 December 2019, residents in Djelfa held a protest to demand the building of the promised cancer treatment center. [size=few hundred]",0,1578512391,DZA
6708539,422,LBN3077,3077,"19 December 2019",2019,1,Protests,"Peaceful protest","Protesters (Lebanon)",,6,,,0,60,"Middle East",Lebanon,Bekaa,Zahleh,,Taalabaya,33.8136,35.8644,1,"An Nahar",Regional,"On December 19 2019, On day 64 of the anti-government demonstrations, demonstrators blocked the main road in Taalbaya in both directions. [size=no report]",0,1578503874,LBN
6713147,729,SUD13534,13534,"19 December 2019",2019,1,Protests,"Peaceful protest","Protesters (Sudan)",,6,,,0,60,"Northern Africa",Sudan,"El Gazira","Greater Wad Madani",,"Wad Medani",14.4004,33.5184,1,"Radio Dabanga; Sudan Tribune",National,"On 19 December 2019, demonstrators marched in Wad Medani (El Gazira state) to commemorate the uprising that began in December 2018, calling for the goals of the revolution to be fulfilled, and justice for those killed in the course of the uprising. [size=thousands]",0,1578512390,SDN
6713148,729,SUD13535,13535,"19 December 2019",2019,1,Protests,"Peaceful protest","Protesters (Sudan)",,6,,,0,60,"Northern Africa",Sudan,"Central Darfur",Zalingei,,Zalingei,12.9,23.4811,1,"Sudan Tribune; Radio Dabanga",National,"On 19 December 2019, demonstrators marched in Gedaref (Gedaref state) to commemorate the uprising that began in December 2018, calling for the goals of the revolution to be fulfilled, and justice for those killed in the course of the uprising. [size=thousands]",0,1578512390,SDN
6715708,356,IND68221,68221,"19 December 2019",2019,1,Protests,"Peaceful protest","Protesters (India)","Students (India)",6,,,0,60,"Southern Asia",India,Karnataka,Mandya,Mandya,Mandya,12.5223,76.8974,1,"The Hindu",National,"On December 19, students held a protest in Mandya city (Mandya, Karnataka), against the Citizenship (Amendment) Act, 2019 (CAA) and National Register of Citizens (NRC). [size=no report]",0,1578514389,IND
6709053,422,LBN3102,3102,"19 December 2019",2019,1,Protests,"Peaceful protest","Protesters (Lebanon)",,6,,,0,60,"Middle East",Lebanon,"Mount Lebanon",Baabda,,"Beirut International Airport",33.8209,35.4884,1,"National News Agency Lebanon",National,"On December 19 2019, Lebanese activists demonstrated outside the Airport in Beirut, against the US Undersecretary of State for Political Affairs' visit to Lebanon. [size=no report]",0,1578503876,LBN
6715965,356,IND68234,68234,"19 December 2019",2019,1,Protests,"Peaceful protest","Protesters (India)","RJD: Rashtriya Janata Dal",6,,,0,60,"Southern Asia",India,Bihar,Patna,Patna,Patna,25.5941,85.1356,1,"Times of India",National,"On 19 December, bandh supporters squatted on rail tracks and stopped a train at Rajendra Nagar area of Patna City (Patna, Bihar) during the RJD-sponsored Bihar bandh against the Citizenship (Amendment) Act, 2019 (CAA). [size=no report]",0,1578514390,IND
6708286,368,IRQ22582,22582,"19 December 2019",2019,1,Protests,"Peaceful protest","Protesters (Iraq)","Teachers (Iraq)",6,,,0,60,"Middle East",Iraq,Muthanna,"As Samawah",,"As Samawah",31.3059,45.2799,1,"Al Mirbad",National,"On Dec 19, a number of lecturers in al Muthanna education department in central As Samawah city protested demanding fixed contracts rather than their temporary contracts which treat them as daily wagers. [size=no report]",0,1578503874,IRQ
6714430,356,IND68270,68270,"19 December 2019",2019,1,Protests,"Peaceful protest","Protesters (India)","JUH: Jamiat Ulema-e-Hind; CPI: Communist Party of India; CPI(M): Communist Party of India (Marxist); Muslim Group (India)",6,,,0,60,"Southern Asia",India,"Himachal Pradesh",Shimla,Shimla,Shimla,31.1044,77.1666,1,"Amar Ujala",National,"On Dec 19, protests were held by members of CPI (M), CPI, Male, Jamiat-e-Ulema-e Hind and Muslim Reform Committee over the Citizenship (Amendment) Act, 2019 (CAA) in Shimla (HP). [size=no report]",0,1578514387,IND
6714686,356,IND68255,68255,"19 December 2019",2019,1,Protests,"Peaceful protest","Protesters (India)","Labour Group (India)",6,,,0,60,"Southern Asia",India,"Jammu and Kashmir",Srinagar,"Srinagar North",Srinagar,34.0857,74.8056,1,"Daily Excelsior",Subnational,"On 19 Dec, half a dozen youtubers protested at Srinagar city (J&K) against the internet shutdown post the abrogation of article 370 and the bifurcation of the state into two UTs. [size=half a dozen]",0,1578514387,IND
6716478,760,SYR73574,73574,"19 December 2019",2019,1,"Explosions/Remote violence","Shelling/artillery/missile attack","Military Forces of Syria (2000-)",,1,,,0,10,"Middle East",Syria,Aleppo,"Jebel Saman","Jebel Saman","Kafr Dael",36.2136,37.0228,1,Liveuamap,"Local partner-New media","On 19 December 2019, regime forces shelled Kafr Dael in western Aleppo countryside using artillery fire with neither fatalities nor injuries reported.",0,1578515227,SYR
6711361,887,YEM45584,45584,"19 December 2019",2019,1,Battles,"Armed clash","Military Forces of Yemen (2016-) Supreme Political Council",,1,"Southern Resistance",,3,13,"Middle East",Yemen,"Ad Dali","Al Azariq",,"Dhi Jalal",13.6238,44.7075,2,"Yemen Data Project; Aden al Ghad","Local partner-National","On 19 December 2019, anti-Houthi Southern Resistance forces of the 5th Brigade reportedly thwarted a pro-Houthi incursion waged from Ash Sahwq and Al Mawris junction against their forces in Al Firasha, west of Al Azariq district (Ad Dali). No fatalities nor injuries reported.",0,1578511258,YEM
6724673,12,ALG7884,7884,"19 December 2019",2019,1,Protests,"Peaceful protest","Protesters (Algeria)","Labour Group (Algeria)",6,,,0,60,"Northern Africa",Algeria,Skikda,Azzaba,,Azzaba,36.7394,7.1053,1,"Liberte (Algeria)",National,"On 19 December 2019, contract workers protested in Azzaba to demand more rights. [size=no report]",0,1579554012,DZA
6857281,112,BLR299,299,"19 December 2019",2019,1,Protests,"Peaceful protest","Protesters (Belarus)","BCD: Belarusian Christian Democracy; Belarusian Green Party; MFF: Movement 'For Freedom'; OGP: United Civic Party of Belarus; Razam Movement",6,,,0,60,Europe,Belarus,Minsk,"City of Minsk",,Minsk-Tsentralny,53.9178,27.5633,1,"RFE/RL; Viasna; Svaboda.org; Belorusskiy Partizan; Nasha Niva; AP; TUT.BY; Charter-97",Other-National,"On 29 December, around 100 people protested on Kastrychnickaja square and Nezalezhnosti square against the plans of integration between Belarus and Russia, as well as against the Lukashenko regime. The protesters also demanded the release of the leaders of the previous protests against the integration plans. The police did not disperse the unsanctioned rally. BCD, OGP, Razam, MFF members, as well as Belarusian Greens, participated in the rally. [size=around 100]",0,1580849930,BLR
6709058,422,LBN3101,3101,"19 December 2019",2019,1,Protests,"Peaceful protest","Protesters (Lebanon)",,6,,,0,60,"Middle East",Lebanon,Bekaa,"Bekaa al-Gharbi",,"El Marj",33.7625,35.8811,2,"National News Agency Lebanon",National,"On December 19 2019, On day 64 of the anti-government demonstrations, demonstrators blocked the Zahle-Marj highway. [size=no report]",0,1578503876,LBN
6711362,887,YEM45585,45585,"19 December 2019",2019,1,Battles,"Armed clash","Military Forces of Yemen (2016-) Supreme Political Council",,1,"Military Forces of Yemen (2012-)",,1,11,"Middle East",Yemen,"Ad Dali","Al Husha",,Battar,13.8176,44.578,2,"Yemen Press; Yemen Data Project","Local partner-National","On 19 December 2019, clashes erupted between pro-Houthi forces and pro-Hadi forces on the Al Jubb and Al Fajir frontlines (Qaatabah, Ad Dali) and on the Battar frontline (Al Husha, Ad Dali). Clashes were triggered by the arrival of pro-Houthi reinforcements coming from Damt and Ibb. No fatalities nor injuries reported.",0,1578511258,YEM
6715714,356,IND68241,68241,"19 December 2019",2019,1,Protests,"Protest with intervention","Protesters (India)","CPI(M): Communist Party of India (Marxist); CPI: Communist Party of India",6,"Police Forces of India (2014-)",,1,16,"Southern Asia",India,"Tamil Nadu",Salem,Salem,Salem,11.6511,78.1586,1,"The Hindu",National,"On December 19, cadres of Communist Party of India and Communist Party of India (Marxist) staged a protest in front of the collectorate in Salem city (Salem, TN), condemning the center for enacting Citizenship (Amendment) Act, 2019 (CAA). The cadres were arrested by police. [size=no report]",0,1578514389,IND
6709571,804,UKR30593,30593,"19 December 2019",2019,1,Protests,"Peaceful protest","Protesters (Ukraine)",,6,,,0,60,Europe,Ukraine,Zaporizhia,Zaporizhia,,Zaporizhia,47.8479,35.1602,1,061.ua,Subnational,"On 19 December, activists came to the regional administration in Zaporizhia with a black Christmas tree and empty medicine bottles drawing attention to the problem of lack of antiretroviral drugs. [size=no report]",0,1578510534,UKR
6710339,804,UKR30556,30556,"19 December 2019",2019,1,Protests,"Peaceful protest","Protesters (Ukraine)","Health Workers (Ukraine)",6,,,0,60,Europe,Ukraine,Rivne,Rivne,,Rivne,50.6231,26.2274,1,"Politychna Krytyka",National,"On 19 December, health workers protested in Rivne demanding raise in their salaries and involvement of medics in designing the reform in the health sector. [size=no report]",0,1578510535,UKR
6711363,887,YEM45588,45588,"19 December 2019",2019,1,Battles,"Armed clash","Military Forces of Yemen (2016-) Supreme Political Council",,1,"Military Forces of Yemen (2012-)",,1,11,"Middle East",Yemen,"Ad Dali",Qaatabah,,"Al Fajir",13.8667,44.6,2,"Yemen Press; Yemen Data Project","Local partner-National","On 19 December 2019, clashes erupted between pro-Houthi forces and pro-Hadi forces on the Al Jubb and Al Fajir frontlines (Qaatabah, Ad Dali) and on the Battar frontline (Al Husha, Ad Dali). Clashes were triggered by the arrival of pro-Houthi reinforcements coming from Damt and Ibb. No fatalities nor injuries reported.",0,1578511258,YEM
6710340,804,UKR30555,30555,"19 December 2019",2019,1,Protests,"Peaceful protest","Protesters (Ukraine)","Health Workers (Ukraine)",6,,,0,60,Europe,Ukraine,Lviv,"Lviv Municipality",,Lviv,49.8407,24.0305,1,"Politychna Krytyka",National,"On 19 December, health workers protested in Lviv demanding raise in their salaries and involvement of medics in designing the reform in the health sector. [size=no report]",0,1578510535,UKR
6711364,887,YEM45590,45590,"19 December 2019",2019,1,Battles,"Armed clash","Military Forces of Yemen (2016-) Supreme Political Council",,1,"Military Forces of Yemen (2012-)",,1,11,"Middle East",Yemen,"Ad Dali",Qaatabah,,"Al Jubb",13.8309,44.6009,2,"Yemen Press; Yemen Data Project","Local partner-National","On 19 December 2019, clashes erupted between pro-Houthi forces and pro-Hadi forces on the Al Jubb and Al Fajir frontlines (Qaatabah, Ad Dali) and on the Battar frontline (Al Husha, Ad Dali). Clashes were triggered by the arrival of pro-Houthi reinforcements coming from Damt and Ibb. No fatalities nor injuries reported.",0,1578511258,YEM
6708037,422,LBN3036,3036,"19 December 2019",2019,1,Protests,"Peaceful protest","Protesters (Lebanon)",,6,,,0,60,"Middle East",Lebanon,North,Tripoli,,Tripoli,34.4367,35.8497,1,"National News Agency Lebanon; AlManar TV",National,"On December 19 2019, On day 64 of the anti-government demonstrations, demonstrators blocked several roads in Tripoli City. Two sound bombs exploded throughout the day near the Abi Samra area. A convoy of motorcycles drove towards the Palma road to join demonstrators. Demonstrators also blocked a main road near the Quality Inn hotel, and gathered at the Salam roundabout. [size=no report]",0,1578503873,LBN
6710341,804,UKR30554,30554,"19 December 2019",2019,1,Protests,"Peaceful protest","Protesters (Ukraine)","Health Workers (Ukraine)",6,,,0,60,Europe,Ukraine,"Kiev City",Kiev,,Kiev-Shevchenkivskyi,50.4646,30.4655,1,"Politychna Krytyka",National,"On 19 December, about 70 health workers protested in central Kyiv demanding raise in their salaries and involvement of medics in designing the reform in the health sector. [size=about 70]",0,1578510535,UKR
6711365,887,YEM45591,45591,"19 December 2019",2019,1,"Violence against civilians","Abduction/forced disappearance","Police Forces of Yemen (2012-)","STC: Southern Transitional Council",1,"Civilians (Yemen)","Government of Yemen (2012-)",7,17,"Middle East",Yemen,Aden,Craiter,,"Aden-Hayy al Qati",12.7764,45.0411,1,"Yemen Data Project; Al Mashhad Al Yemeni","Local partner-National","On 19 December 2019, a pro-STC group of security forces reportedly broke into the Central Bank of Yemen and abducted Nayf al Humaydi, Director of the Ministry of Interior's Budget Department, in Hayy al Qati neighbourhood of Craiter district (Aden). The pro-STC group, composed by 20 military vehicles, was led by Aden's former Security Director Shilal Shay.",0,1578511258,YEM
6708038,422,LBN3049,3049,"19 December 2019",2019,1,Protests,"Peaceful protest","Protesters (Lebanon)",,6,,,0,60,"Middle East",Lebanon,Beirut,Beirut,,Beirut-Mazraa,33.8783,35.5073,1,"National News Agency Lebanon; Murr TV",National,"On December 19 2019, On day 64 of the anti-government demonstrations, demonstrators blocked the Qasqas road in Beirut and a road outside the Sport City stadium in Beirut. [size=no report]",0,1578503873,LBN
6711366,887,YEM45592,45592,"19 December 2019",2019,1,"Explosions/Remote violence","Shelling/artillery/missile attack","Military Forces of Yemen (2016-) Supreme Political Council",,1,"National Resistance Forces",,3,13,"Middle East",Yemen,"Al Hudaydah","Ad Durayhimi",,"Ad Durayhimi",14.637,43.0551,2,"Yemen Data Project; Al Amaliqah","Local partner-National","On 19 December 2019, pro-Houthi forces reportedly fired calibre 120mm and 82mm mortar shells and Howitzer artillery at anti-Houthi National Resistance forces east of Ad Durayhimi district (Al Hudaydah). No fatalities nor injuries reported.",0,1578511258,YEM
6711367,887,YEM45593,45593,"19 December 2019",2019,1,Battles,"Armed clash","Military Forces of Yemen (2016-) Supreme Political Council",,1,"National Resistance Forces",,3,13,"Middle East",Yemen,"Al Hudaydah","Ad Durayhimi",,"Ad Durayhimi",14.637,43.0551,2,"Yemen Data Project; Al Amaliqah","Local partner-National","On 19 December 2019, pro-Houthi forces reportedly fired ZU-23 cannon shells, calibre 12.7mm and 14.5mm medium weapons, and PK machine guns at anti-Houthi National Resistance forces north and south of Ad Durayhimi district (Al Hudaydah). No fatalities nor injuries reported.",0,1578511258,YEM
6709064,422,LBN3100,3100,"19 December 2019",2019,1,Protests,"Peaceful protest","Protesters (Lebanon)",,6,,,0,60,"Middle East",Lebanon,North,Koura,,"Kfar Hazir",34.3111,35.7753,2,"National News Agency Lebanon",National,"On December 19 2019, On day 64 of the anti-government demonstrations, demonstrators blocked the Kfar Hazir-Koura highway. [size=no report]",0,1578503876,LBN
6711368,887,YEM45594,45594,"19 December 2019",2019,1,"Explosions/Remote violence","Shelling/artillery/missile attack","National Resistance Forces",,3,"Civilians (Yemen)",,7,37,"Middle East",Yemen,"Al Hudaydah","Ad Durayhimi",,"Ad Durayhimi",14.637,43.0551,2,"Yemen Data Project; Al Masirah","Local partner-National","On 19 December 2019, anti-Houthi National Resistance forces reportedly fired mortar shells at Al Jirbah as Sufla village (Ad Durayhimi, Al Hudaydah), injuring a child.",0,1578511258,YEM
6716232,760,SYR73348,73348,"19 December 2019",2019,1,Battles,"Government regains territory","Military Forces of Syria (2000-)","QDW: National Defense Forces; LaQ: Quds Brigade; Allied Syrian and/or Russian Forces",1,"Opposition Rebels (Syria)","Islamist Militia (Syria)",2,12,"Middle East",Syria,Idleb,"Al Ma'ra",Tamanaah,"Um Jalal",35.5033,36.7868,1,"Liveuamap; SOHR","Local partner-New media","On 19 December 2019, regime forces captured Um Jalal in Idleb following clashes between regime forces, supported by National Defense Forces and Quds Brigade militias, and rebel and Islamist factions. Clashes were accompanied by exchange of shelling and airstrikes by regime and/or Russian warplanes. Clashes, airstrikes and shelling in Raffa, Um Jalal, Um al Tinah, Al-Khuraybah, Rabiah, Ash Sha'rah, Barnan, Sihal, Farja, Abu Habbeh, and other areas in the south-eastern countryside of Idleb resulted in the killing of 42 regime and National Defense Forces and Quds Brigade militias and 70 rebel and Islamistfactions fighters. Total fatalities of 112 are split as follows: 11 Raffa, 11 Um Jalal, 10 Um al Tinah, 10 Al-Khuraybah, 10 Rabiah, 10 Ash Sha'rah, 10 Barnan, 10 Sihal, 10 Farja, 10 Abu Habbeh, and 10 for other areas in the south-eastern countryside of Idleb.",11,1578515226,SYR
6711369,887,YEM45595,45595,"19 December 2019",2019,1,"Explosions/Remote violence","Shelling/artillery/missile attack","National Resistance Forces",,3,,,0,30,"Middle East",Yemen,"Al Hudaydah","Ad Durayhimi",,"Ash Shaykh al Hasamah",14.7702,43.072,1,"Yemen Data Project; Al Masirah","Local partner-National","On 19 December 2019, anti-Houthi National Resistance forces reportedly fired machine guns at Zafaran and Mahall ash Shaykh villages (Ad Durayhimi, Al Hudaydah). No fatalities nor injuries reported.",0,1578511258,YEM
6714441,356,IND68267,68267,"19 December 2019",2019,1,Protests,"Peaceful protest","Protesters (India)","INC: Indian National Congress",6,,,0,60,"Southern Asia",India,Uttarakhand,Haridwar,Roorkee,Roorkee,29.8663,77.8911,2,"Amar Ujala",National,"On Dec 19, protests were led by INC over the Citizenship (Amendment) Act, 2019 (CAA) in Kaliyar near Roorkee (Uttarakhand). [size=no report]",0,1578514387,IND
6715721,356,IND68251,68251,"19 December 2019",2019,1,Protests,"Peaceful protest","Protesters (India)","Students (India)",6,,,0,60,"Southern Asia",India,"Tamil Nadu",Vellore,Vellore,Vellore,12.9184,79.1325,1,"The Hindu",National,"On December 19, students from the Government Law College staged a protest in Vellore city (Vellore, TN), against the Citizenship (Amendment) Act, 2019 (CAA) and National Register of Citizens (NRC). [size=no report]",0,1578514389,IND
6857289,356,IND68292,68292,"19 December 2019",2019,1,Riots,"Violent demonstration","Rioters (India)","BJP: Bharatiya Janata Party",5,"Rioters (India)","CPI(M): Communist Party of India (Marxist)",5,55,"Southern Asia",India,Tripura,"South Tripura",Belonia,Belonia,23.2504,91.4679,1,"South Asia Terrorism Portal; Tripura Infoway; Telegraph (India)",Other-Subnational,"On 19 December, workers of BJP and CPI (M) clashed and pelted stones at each other at Belonia (South Tripura district, Tripura) during demonstrations relating to the Citizenship (Amendment) Act, 2019 (CAA). Two police officers suffered injuries. [size=no report]",0,1580849930,IND
6711370,887,YEM45596,45596,"19 December 2019",2019,1,"Explosions/Remote violence","Shelling/artillery/missile attack","National Resistance Forces",,3,,,0,30,"Middle East",Yemen,"Al Hudaydah","Ad Durayhimi",,"Bir az Zafaran",14.7192,43.0575,1,"Yemen Data Project; Al Masirah","Local partner-National","On 19 December 2019, anti-Houthi National Resistance forces reportedly fired machine guns at Zafaran and Mahall ash Shaykh villages (Ad Durayhimi, Al Hudaydah). No fatalities nor injuries reported.",0,1578511258,YEM
6711371,887,YEM45597,45597,"19 December 2019",2019,1,"Explosions/Remote violence","Shelling/artillery/missile attack","National Resistance Forces",,3,,,0,30,"Middle East",Yemen,"Al Hudaydah","Ad Durayhimi",,Shajan,14.6396,43.1055,1,"Al Masirah; Yemen Data Project","Local partner-National","On 19 December 2019, anti-Houthi National Resistance forces reportedly fired 14 artillery shells at Shajan village (Ad Durayhimi, Al Hudaydah). No fatalities nor injuries reported.",0,1578511258,YEM
6715723,356,IND68228,68228,"19 December 2019",2019,1,Protests,"Peaceful protest","Protesters (India)","Students (India)",6,,,0,60,"Southern Asia",India,Maharashtra,Osmanabad,Osmanabad,Osmanabad,18.1841,76.0381,1,"The Hindu",National,"On 19 December, students of the Tata Institute of Social Sciences held a protest in Osmanabad (Osmanabad, Maharashtra) against the Citizenship (Amendment) Act, 2019 (CAA) and National Register of Citizens (NRC). [size=no report]",0,1578514389,IND
6724171,566,NIG15906,15906,"19 December 2019",2019,1,Protests,"Peaceful protest","Protesters (Nigeria)","Labour Group (Nigeria)",6,,,0,60,"Western Africa",Nigeria,"Federal Capital Territory","Abuja Municipal",,Abuja,9.0833,7.5333,1,"Daily Trust (Nigeria); Nigeria Punch",Subnational-National,"On 19 December 2019, employees of NIPOST in Abuja demonstrated over the plan to outsource the stamp duty to the Federal Inland Revenue Service. [size=no report]",0,1579554010,NGA
6711372,887,YEM45598,45598,"19 December 2019",2019,1,"Explosions/Remote violence","Shelling/artillery/missile attack","National Resistance Forces",,3,,,0,30,"Middle East",Yemen,"Al Hudaydah","At Tuhayat",,"Al Jabaliyah",14.0725,43.1589,1,"Yemen Data Project; Al Masirah","Local partner-National","On 19 December 2019, anti-Houthi National Resistance forces reportedly fired 3 artillery rockets at Al Jabaliyah area (At Tuhayat, Al Hudaydah). No fatalities nor injuries reported.",0,1578511258,YEM
6724172,566,NIG15907,15907,"19 December 2019",2019,1,Protests,"Peaceful protest","Protesters (Nigeria)","Labour Group (Nigeria)",6,,,0,60,"Western Africa",Nigeria,"Federal Capital Territory","Abuja Municipal",,Abuja,9.0833,7.5333,1,"The Cable (Nigeria); Blueprint",National,"On 19 December 2019, legislative aides demonstrated over unpaid allowances in Abuja at the National Assembly. [size=no report]",0,1579554010,NGA
6711373,887,YEM45599,45599,"19 December 2019",2019,1,Battles,"Armed clash","Military Forces of Yemen (2016-) Supreme Political Council",,1,"National Resistance Forces","Giants Brigade",3,13,"Middle East",Yemen,"Al Hudaydah","At Tuhayat",,"At Tuhayta",14.1836,43.2264,2,"Yemen Press Agency; Yemen Data Project","Local partner-National","On 19 December 2019, clashes erupted between pro-Houthi groups and anti-Houthi Giants Brigade forces in At Tuhayta district (Al Hudaydah). 2 Giants Brigade commanders were killed.",2,1578511258,YEM
6711885,887,YEM45589,45589,"19 December 2019",2019,1,"Strategic developments","Change to group/activity","Military Forces of Yemen (2016-) Supreme Political Council",,1,,,0,10,"Middle East",Yemen,"Ad Dali",Qaatabah,,"Al Fajir",13.8667,44.6,2,"Nukhba Hadramawt",National,"On 19 December, pro-Houthi reinforcements were reported to be heading to the al-Maris (Damt, Ad Dali) and al-Fajir (Qaatabah, Ad Dali) fronts from the city of Damt (Damt, Ad Dali) in response to a recent uptick in clashes with Southern Resistance forces in the area.",0,1578511260,YEM
