data_id,iso,event_id_cnty,event_id_no_cnty,event_date,year,time_precision,event_type,sub_event_type,actor1,assoc_actor_1,inter1,actor2,assoc_actor_2,inter2,interaction,region,country,admin1,admin2,admin3,location,latitude,longitude,geo_precision,source,source_scale,notes,fatalities,timestamp,iso3
6712450,764,THA7477,7477,"19 December 2019",2019,1,Protests,"Peaceful protest","Protesters (Thailand)","P-Move: The People's Movement for a Just Society",6,,,0,60,"South-Eastern Asia",Thailand,Bangkok,"Wang Thonglang",,Phlabphla,13.7672,100.6116,1,Prachatai,National,"On 19 December 2019, around 30 members of P-Move Group gathered at the Human Settlement Foundation in kwaeng Phlabphla, Wang Thonglang district of Bangkok, Thailand, to demand progress after the group had filed a petition on social inequality to the Prime Minister four months ago. [size=around 30]",0,1578511387,THA
6717570,31,AZE12651,12651,"19 December 2019",2019,1,Battles,"Armed clash","Military Forces of Artsakh (2007-)",,1,"Military Forces of Azerbaijan (2003-)",,1,11,"Caucasus and Central Asia",Azerbaijan,Tartar,,,Terter,40.3428,46.9317,2,"Ministry of Defence of Azerbaijan",Other,"On 19 December, military forces of Artsakh located at Chilaburt fired with unspecified weapons on the positions of the military forces of Azerbaijan assumed to be located near Terter, Tartar.",0,1578517426,AZE
6815875,4,AFG42319,42319,"19 December 2019",2019,2,"Explosions/Remote violence","Remote explosive/landmine/IED",Taliban,,2,"NATO: North Atlantic Treaty Organization",,8,28,"Caucasus and Central Asia",Afghanistan,Kandahar,Daman,,Daman,31.619,65.8982,2,"Voice of Jihad",Other,"As reported on 19 December 2019, a NATO tank was hit by a Taliban-planted landmine in Daman district, Kandahar. No fatalities were reported",0,1580846886,AFG
6708355,368,IRQ22583,22583,"19 December 2019",2019,1,Protests,"Peaceful protest","Protesters (Iraq)",,6,,,0,60,"Middle East",Iraq,Najaf,Najaf,,Najaf,32.0259,44.3462,1,"Al Mirbad",National,"On Dec 19, protesters in central Najaf gathered demanding the dismissal of the Najaf police chief. [size=no report]",0,1578503874,IRQ
6715267,586,PAK55154,55154,"19 December 2019",2019,1,"Explosions/Remote violence","Remote explosive/landmine/IED","Unidentified Armed Group (Pakistan)",,3,"Police Forces of Pakistan (2018-) Frontier Corps",,1,13,"Southern Asia",Pakistan,"Khyber Pakhtunkhwa",Khyber,"Landi Kotal","Landi Kotal",34.1138,71.1672,2,"Nation (Pakistan)",National,"On December 19, an unclaimed IED went off when FC troops carrying out their routine patrol hit the IED at Khona Kandaw, Pasad Khel near the Pak-Afghan border area of Khyber district (KP). One FC personnel was killed and three others sustained injuries in the explosion.",1,1578514388,PAK
6717571,31,AZE12652,12652,"19 December 2019",2019,1,Battles,"Armed clash","Military Forces of Artsakh (2007-)",,1,"Military Forces of Azerbaijan (2003-)",,1,11,"Caucasus and Central Asia",Azerbaijan,Agdam,,,Orta-Karvend,40.1587,47.0483,2,"Ministry of Defence of Azerbaijan",Other,"On 19 December, military forces of Artsakh located at Taghibeyli fired with unspecified weapons on the positions of the military forces of Azerbaijan assumed to be located near Orta-Karvend, Agdam.",0,1578517426,AZE
6815876,4,AFG42060,42060,"19 December 2019",2019,1,Battles,"Armed clash",Taliban,,2,"Military Forces of Afghanistan (2014-)",,1,12,"Caucasus and Central Asia",Afghanistan,Paktika,"Waza Khwa",,"Waza Khwa",32.2003,68.3641,2,"Afghan Ministry of Defense",Other,"As reported on 20 December 2019, over the past 24 hours, 1 suspected Taliban militant was killed when Afghan military forces repulsed their attack in Waza Khwa district, Paktika.",1,1580846886,AFG
6710404,804,UKR30594,30594,"19 December 2019",2019,1,Protests,"Peaceful protest","Protesters (Ukraine)","Stop Corruption",6,,,0,60,Europe,Ukraine,"Kiev City",Kiev,,Kiev-Pecherskyi,50.427,30.5454,1,"Stop Corruption",National,"On 19 December, people, including members of Stop Corruption, protested outside the National Bank of Ukraine in Kyiv demanding bringing to justice the head and a deputy head of the National Bank for covering up corruption schemes. [size=no report]",0,1578510535,UKR
6713476,466,MLI3353,3353,"19 December 2019",2019,1,"Strategic developments","Looting/property destruction","JNIM: Group for Support of Islam and Muslims",,2,"Civilians (Mali)","Dogon Ethnic Group (Mali); Women (Mali)",7,27,"Western Africa",Mali,Mopti,Douentza,Mondoro,Mondoro,14.6762,-1.9513,2,Facebook,"New media","On 19 December 2019, suspected JNIM militants burned cars belonging to Dogon women near Mondoro.",0,1578512391,MLI
6715780,356,IND68229,68229,"19 December 2019",2019,1,Riots,"Violent demonstration","Rioters (India)","Muslim Group (India)",5,"Police Forces of India (2014-)",,1,15,"Southern Asia",India,Gujarat,"Banas Kantha",Palanpur,Palanpur,24.1712,72.4382,2,"Times of India",National,"On 19 December, Muslim outfits demonstrated in Banas Kantha district (Gujarat) against the Citizenship (Amendment) Act, 2019 (CAA) and attacked a police vehicle. [size=no report]",0,1578514390,IND
6717572,31,AZE12653,12653,"19 December 2019",2019,1,Battles,"Armed clash","Military Forces of Artsakh (2007-)",,1,"Military Forces of Azerbaijan (2003-)",,1,11,"Caucasus and Central Asia",Azerbaijan,Khojavend,,,Nargiztapa,39.847,47.1854,2,"Ministry of Defence of Azerbaijan",Other,"On 19 December, military forces of Artsakh located at Kuropatkino fired with unspecified weapons on the positions of the military forces of Azerbaijan assumed to be located near Nargiztapa, Khojavend.",0,1578517426,AZE
6815877,4,AFG42301,42301,"19 December 2019",2019,1,"Explosions/Remote violence","Remote explosive/landmine/IED",Taliban,,2,"Military Forces of Afghanistan (2014-)",,1,12,"Caucasus and Central Asia",Afghanistan,Wardak,Saydabad,,Mangali,33.7374,68.5298,1,"Voice of Jihad",Other,"On 19 December 2019, 2 soldiers were killed and 1 was wounded when their tank were hit by a Taliban-planted landmine in the Mangali area of Saydabad district, Wardak. fatalities coded as 0 (VoJ reported 2 fatalities).",0,1580846886,AFG
6715269,586,PAK55163,55163,"19 December 2019",2019,1,Protests,"Peaceful protest","Protesters (Pakistan)","Labour Group (Pakistan)",6,,,0,60,"Southern Asia",Pakistan,Punjab,Lahore,Lahore,Lahore-Gulberg,31.5134,74.3467,1,"Nation (Pakistan)",National,"On December 19, activists of the Awami Rickshaw Union and Awami Pasban held a rally outside Lahore Press Club in Gulberg town (Lahore, Punjab) against India over continuing lockdown in Indian Administered Kashmir. [size=no report]",0,1578514388,PAK
6716293,760,SYR73572,73572,"19 December 2019",2019,1,"Explosions/Remote violence","Shelling/artillery/missile attack","Military Forces of Syria (2000-)",,1,,,0,10,"Middle East",Syria,Hama,As-Suqaylabiyah,Ziyara,Al-Mashiak,35.7128,36.3323,1,"Liveuamap; SHAM","Local partner-New media","On 19 December 2019, regime forces shelled al-Mashiak in Hama with neither fatalities nor injuries reported.",0,1578515226,SYR
6717573,31,AZE12654,12654,"19 December 2019",2019,1,Battles,"Armed clash","Military Forces of Artsakh (2007-)",,1,"Military Forces of Azerbaijan (2003-)",,1,11,"Caucasus and Central Asia",Azerbaijan,Fizuli,,,Horadiz,39.451,47.3314,2,"Ministry of Defence of Azerbaijan",Other,"On 19 December, military forces of Artsakh located at Horadiz fired with unspecified weapons on the positions of the military forces of Azerbaijan assumed to be located near Horadiz, Fizuli.",0,1578517426,AZE
6815878,4,AFG42303,42303,"19 December 2019",2019,2,Battles,"Armed clash",Taliban,,2,"Military Forces of Afghanistan (2014-)",,1,12,"Caucasus and Central Asia",Afghanistan,Khost,Qalandar,,Qalandar,33.5151,69.676,2,"Voice of Jihad",Other,"As reported on 19 December 2019, 1 soldier was wounded following an attack by Taliban militants in Qalandar (Dwah Mande) district, Khost.",0,1580846886,AFG
6709638,804,UKR30560,30560,"19 December 2019",2019,1,"Explosions/Remote violence","Shelling/artillery/missile attack","Military Forces of Ukraine (2019-)",,1,"NAF: United Armed Forces of Novorossiya","Donbass People's Militia",2,12,Europe,Ukraine,Donetsk,"Horlivka Municipality",,Mykhaylivka,48.2444,37.9747,2,"DPR Armed Forces Press Service",Other,"On 19 December, the Ukrainian Forces fired 82mm mortars at the positions of the Donbass People's Militia in the area of Mykhaylivka, Donetsk.",0,1578510534,UKR
6717574,31,AZE12655,12655,"19 December 2019",2019,1,Battles,"Armed clash","Military Forces of Artsakh (2007-)",,1,"Military Forces of Azerbaijan (2003-)",,1,11,"Caucasus and Central Asia",Azerbaijan,Fizuli,,,Qazaxlar,39.4057,47.3203,2,"Ministry of Defence of Azerbaijan",Other,"On 19 December, military forces of Artsakh located at Nuzgar fired with unspecified weapons on the positions of the military forces of Azerbaijan assumed to be located near Qazaxlar, Fizuli.",0,1578517426,AZE
6815879,4,AFG42017,42017,"19 December 2019",2019,1,"Explosions/Remote violence","Remote explosive/landmine/IED","Unidentified Armed Group (Afghanistan)",,3,"Civilians (Afghanistan)",,7,37,"Caucasus and Central Asia",Afghanistan,Kabul,Kabul,,Kabul,34.5167,69.1833,1,"Pajhwok Afghan News; New York Times",National-International,"On 19 December 2019, 1 civilian was killed and 2 were wounded when a roadside bomb exploded in the limits of PD5, Bagh-e-Daoud area of Kabul city. It's unclear who planted the bomb.",1,1580846886,AFG
6815880,4,AFG42052,42052,"19 December 2019",2019,1,Battles,"Armed clash","Military Forces of Afghanistan (2014-)",,1,Taliban,,2,12,"Caucasus and Central Asia",Afghanistan,Laghman,Qarghayi,,Lalkhanabad,34.547,70.2444,2,"Pajhwok Afghan News; Afghan Ministry of Defense",National-Other,"As reported on 20 December 2019, over the past 24 hours, 11 Taliban militants were killed by Afghan forces airstrikes in the Zango area of Qarghayi district, Laghman.",11,1580846886,AFG
6710408,804,UKR30552,30552,"19 December 2019",2019,1,Protests,"Peaceful protest","Protesters (Ukraine)","Farmers (Ukraine)",6,,,0,60,Europe,Ukraine,Zaporizhia,Melitopol,,Novobohdanivka,47.0856,35.3253,2,"Stop Corruption",National,"On 19 December, farmers and other activists blocked a highway near Novobohdanivka, Zaporizhia, in protest against the opening of the land market to foreign investors and selling more than 5000 hectares of land to one buyer. [size=no report]",0,1578510535,UKR
6815881,4,AFG42309,42309,"19 December 2019",2019,1,Battles,"Armed clash",Taliban,,2,"Police Forces of Afghanistan (2014-)",,1,12,"Caucasus and Central Asia",Afghanistan,Takhar,"Dashti Qala",,"Dashti Qala",37.2216,69.4975,2,"Voice of Jihad",Other,"On 19 December 2019, 1 policeman was killed and 1 was wounded following an attack by Taliban militants in Dashti Qala district, Takhar. Fatalities coded as 0 (VoJ reported 1 fatality).",0,1580846886,AFG
6766217,422,LBN3030,3030,"19 December 2019",2019,1,Riots,"Violent demonstration","Rioters (Lebanon)",,5,"Rioters (Lebanon)","Military Forces of Lebanon (2019-2020)",5,55,"Middle East",Lebanon,Beirut,Beirut,,"Beirut-Ras Beirut",33.8919,35.4816,1,"AlManar TV",National,"On December 19 2019, On day 64 of the anti-government demonstrations, demonstrators blocking roads in Beirut's Corniche el Mazraa area clashed with citizens who were not taking part in the demonstration. Military forces then intervened and stopped the clashes. [size=no report]",0,1580244054,LBN
6715785,356,IND68193,68193,"19 December 2019",2019,1,Protests,"Peaceful protest","Protesters (India)","RJD: Rashtriya Janata Dal",6,,,0,60,"Southern Asia",India,Bihar,Nalanda,"Bihar Sharif","Bihar Sharif",25.2008,85.5238,1,"Times of India",National,"On 19 December, bandh supporters squatted on rail tracks and stopped a train in Bihar Sharif (Nalanda, Bihar) during the RJD-sponsored Bihar bandh against the Citizenship (Amendment) Act, 2019 (CAA). [size=no report]",0,1578514390,IND
6815882,4,AFG42313,42313,"19 December 2019",2019,1,"Explosions/Remote violence","Remote explosive/landmine/IED",Taliban,,2,"Military Forces of Afghanistan (2014-)",,1,12,"Caucasus and Central Asia",Afghanistan,Kandahar,Miyanishin,,Miyanishin,32.3823,66.3382,2,"Voice of Jihad",Other,"On 19 December 2019, 2 soldiers were killed by a Taliban-planted IED in Miyanishin district, Kandahar. Fatalities coded as 0 (VoJ reported 2 fatalities).",0,1580846886,AFG
6766218,422,LBN3074,3074,"19 December 2019",2019,1,Protests,"Protest with intervention","Protesters (Lebanon)",,6,"Military Forces of Lebanon (2019-2020)",,1,16,"Middle East",Lebanon,Baalbek-Hermel,Baalbek,,Baalbek,34.0058,36.2181,1,"An Nahar",Regional,"On December 19 2019, On day 64 of the anti-government demonstrations, demonstrators blocked the Khalil Mutran square in Baalbek City, rejecting Hassan Diab as the new PM. After a demonstrator opened fire at a civilian attempting to pass through, the Lebanese military intervened and re-opened the road. [size=no report]",0,1580244054,LBN
6708106,792,TUR10431,10431,"19 December 2019",2019,1,Protests,"Peaceful protest","Protesters (Turkey)",,6,,,0,60,"Middle East",Turkey,Istanbul,Fatih,,Fatih,41.0225,28.9408,1,"Takvim; Ihlas News Agency",National,"On December 19, 50 animal rights activists gathered outside the administrative building of the Istanbul Municipality in Fatih district, to protest the destruction of 81 horses by the municipality due to the glanders outbreak among the animals in Prince Islands. The protesters demanded the municipality to ban the horse-drawn carriages in Istanbul. [size=50]",0,1578503873,TUR
6713226,562,NIR1106,1106,"19 December 2019",2019,1,Protests,"Peaceful protest","Protesters (Sudan)","Refugees/IDPs (Sudan)",6,,,0,60,"Western Africa",Niger,Agadez,Tchirozerine,"ZR Tchirozerine",Agadez,16.97,7.99,1,"Air Info",Subnational,"On 19 December 2019, Sudanese asylum seekers including men, women, and children demonstrated in front of the UNHCR office in Agadez.[size=hundreds]",0,1578512391,NER
6815883,4,AFG42016,42016,"19 December 2019",2019,1,Battles,"Armed clash",Taliban,,2,"Police Forces of Afghanistan (2014-) National Directorate of Security",,1,12,"Caucasus and Central Asia",Afghanistan,Takhar,Ishkamish,,Ishkamish,36.3798,69.3236,2,"New York Times",International,"On 19 December 2019, 2 NDS officers were killed following an attack by Taliban militants on a check point in Ishkamish district, Takhar.",2,1580846886,AFG
6766219,422,LBN3186,3186,"19 December 2019",2019,1,"Strategic developments",Other,"Government of Lebanon (2019-2020)",,1,,,0,10,"Middle East",Lebanon,Beirut,Beirut,,Beirut,33.8889,35.4944,3,"BBC News",International,"Non-violent activity: On December 19 2019, The University professor and former Education Minister Hassan Diab was appointed as the new prime minister to Lebanon and tasked with forming a new government.",0,1580244054,LBN
6708107,792,TUR10434,10434,"19 December 2019",2019,1,"Strategic developments","Change to group/activity","Government of Turkey (2016-)",,1,,,0,10,"Middle East",Turkey,Sanliurfa,Sanliurfa,,Sanliurfa,37.1671,38.7939,3,"Anadolu Agency; Demokrat Haber; Ihlas News Agency",National,"Security measures: On December 20, Sanliurfa Governor's Office announced a ban on all forms of marches, protests, press conferences, sit-ins and other political actions across Sanliurfa province for 30 days, effective as of December 19.",0,1578503873,TUR
6725259,434,LBY9034,9034,"19 December 2019",2019,1,Battles,"Armed clash","Military Forces of Libya (2014-) Haftar Faction",,1,"Military Forces of Libya (2016-) Government of National Accord",,1,11,"Northern Africa",Libya,Tripoli,Tripoli,,Tripoli,32.8925,13.18,1,Libya24,National,"On 19 December 2019, LNA and GNA forces clashed in southern Tripoli, no casualties reported.",0,1579554014,LBY
6815884,4,AFG42085,42085,"19 December 2019",2019,2,Protests,"Peaceful protest","Protesters (Afghanistan)",,6,,,0,60,"Caucasus and Central Asia",Afghanistan,Herat,Hirat,,Herat,34.3482,62.1997,3,"Arzu TV",National,"As reported on 19 December 2019, residents of of western Herat province protested the rise of violence in the province. [size=no report]",0,1580846886,AFG
6713484,434,LBY9033,9033,"19 December 2019",2019,1,"Strategic developments",Other,"Protesters (Libya)","Teachers (Libya)",6,,,0,60,"Northern Africa",Libya,Sebha,Sebha,,Sabha,27.0377,14.4283,1,"Fezzan Libya",National,"On 19 December 2019, schools in Sebha closed down in reaction to the killing of a teacher by a student.",0,1578512391,LBY
6725260,434,LBY9029,9029,"19 December 2019",2019,1,"Strategic developments",Other,"Protesters (Libya)","Teachers (Libya); Students (Libya)",6,,,0,60,"Northern Africa",Libya,Tripoli,Tripoli,,"Abu Salim",32.85,13.1667,1,Libya24,National,"On 19 December 2019, schools in the Abu Salim area of Tripoli suspended classes due to armed clashes.",0,1579554014,LBY
6815885,4,AFG42050,42050,"19 December 2019",2019,2,Battles,"Armed clash","Police Forces of Afghanistan (2014-)",,1,Taliban,,2,12,"Caucasus and Central Asia",Afghanistan,Paktika,"Waza Khwa",,"Waza Khwa",32.2003,68.3641,2,"Pajhwok Afghan News",National,"As reported on 19 December 2019, 4 Taliban militants were killed and 4 were wounded following a raid by police forces in the Gawashti area of Waza Khwa district, Paktika.",4,1580846886,AFG
6725261,434,LBY9031,9031,"19 December 2019",2019,1,"Explosions/Remote violence","Air/drone strike","Military Forces of Libya (2014-) Haftar Faction",,1,"Military Forces of Libya (2016-) Government of National Accord",,1,11,"Northern Africa",Libya,Tripoli,Tripoli,,"Ayn Zarah",32.8133,13.2697,1,Libya24,National,"On 19 December 2019, LNA conducted airstrike and clashed with GNA forces in Ayn Zarah, no casualties reported.",0,1579554014,LBY
6815886,4,AFG42056,42056,"19 December 2019",2019,1,Battles,"Armed clash","Taliban and/or Islamic State (Afghanistan)",,2,"Military Forces of Afghanistan (2014-)",,1,12,"Caucasus and Central Asia",Afghanistan,Balkh,Zari,,Zari,35.9631,66.7074,2,"Afghan Ministry of Defense",Other,"As reported on 20 December 2019, over the past 24 hours, 18 Taliban and/or IS militants were killed and 12 were wounded when Afghan military forces repulsed their attacks in Zari district, Balkh.",18,1580846886,AFG
6715790,356,IND68240,68240,"19 December 2019",2019,1,Protests,"Peaceful protest","Protesters (India)","RJD: Rashtriya Janata Dal",6,,,0,60,"Southern Asia",India,Bihar,Saharsa,Saharsa,Saharsa,25.8823,86.6022,1,"Times of India",National,"On 19 December, bandh supporters squatted on rail tracks and stopped a train in Saharsa (Saharsa, Bihar) during the RJD-sponsored Bihar bandh against the Citizenship (Amendment) Act, 2019 (CAA). [size=no report]",0,1578514390,IND
6815887,4,AFG42049,42049,"19 December 2019",2019,1,Protests,"Excessive force against protesters","Protesters (Afghanistan)",,6,"Police Forces of Afghanistan (2014-)",,1,16,"Caucasus and Central Asia",Afghanistan,Urozgan,Gizab,,Gizab,33.3377,66.2843,1,"Pajhwok Afghan News",National,"On 19 December 2019, 3 protesters were killed by policemen during a rally against the orders that they had to leave their homes, in Gizab district center, Urozgan. [size=no report]",3,1580846886,AFG
6709647,804,UKR30563,30563,"19 December 2019",2019,1,"Explosions/Remote violence","Shelling/artillery/missile attack","Military Forces of Ukraine (2019-)",,1,"NAF: United Armed Forces of Novorossiya","Donbass People's Militia",2,12,Europe,Ukraine,Donetsk,Yasynuvata,,Spartak,48.079,37.7635,2,"DPR Armed Forces Press Service",Other,"On 19 December, the Ukrainian Forces fired 120mm mortars, heavy machine guns and grenade launchers at the positions of the Donbass People's Militia in the area of Spartak, Donetsk.",0,1578510534,UKR
6815888,4,AFG42051,42051,"19 December 2019",2019,2,Battles,"Armed clash","Police Forces of Afghanistan (2014-)",,1,Taliban,,2,12,"Caucasus and Central Asia",Afghanistan,Paktika,Sarobi,,Sarobi,32.7933,69.0866,2,"Pajhwok Afghan News",National,"As reported on 19 December 2019, 3 Taliban militants were killed and 2 were wounded during a police raid in the Sulaimnkhel area of Sarobi district, Paktika.",3,1580846886,AFG
6709136,275,PSE6635,6635,"19 December 2019",2019,1,"Explosions/Remote violence","Air/drone strike","Military Forces of Israel (2009-)",,8,"Hamas Movement",,3,38,"Middle East",Palestine,"Gaza Strip","North Gaza",,"Bayt Lahya",31.5464,34.4951,2,"Times of Israel",Regional,"On December 19 2019, Israeli aircrafts targeted a military installation of Hamas in the northern Gaza Strip. The attack came in retaliation of a rocket fire from Gaza into Israel earlier.",0,1578503876,PSE
6713488,180,DRC16273,16273,"19 December 2019",2019,1,Protests,"Peaceful protest","Protesters (Democratic Republic of Congo)","LUCHA: Fight for Change",6,,,0,60,"Middle Africa","Democratic Republic of Congo",Nord-Kivu,Butembo,Butembo,Butembo,0.142,29.291,1,"Fizi Media TV",National,"On 19 December 2019, LUCHA protested in Butembo against the torture of its militants and the impunity of authors of these acts. [Size=unreported].",0,1578512391,COD
6715024,586,PAK55151,55151,"19 December 2019",2019,1,Battles,"Armed clash","Military Forces of Pakistan (2018-)",,1,"Military Forces of India (2014-)","Police Forces of India (2014-) Border Security Force",8,18,"Southern Asia",Pakistan,"Azad Jammu and Kashmir",Neelum,Athmuqam,Jura,34.4883,73.8309,2,"Frontier Post",National,"On 19 Dec, two Pakistani civilians were killed and another two civilians and three Pakistan soldiers were injured when India and Pakistan military forces exchanged fire across the LoC in Jura sector area (Neelum district, AJK).",2,1578514388,PAK
6815889,4,AFG42293,42293,"19 December 2019",2019,1,"Explosions/Remote violence","Remote explosive/landmine/IED",Taliban,,2,"Military Forces of Afghanistan (2014-)",,1,12,"Caucasus and Central Asia",Afghanistan,Zabul,Qalat,,Qalat,32.1058,66.9083,1,"Voice of Jihad",Other,"On 19 December 2019, 8 soldiers were killed when their tank was hit by a Taliban-planted landmine in Qalat city, Zabul. fatalities coded as 0 (VoJ reported 8 fatalities).",0,1580846886,AFG
6815890,4,AFG42295,42295,"19 December 2019",2019,1,"Explosions/Remote violence","Remote explosive/landmine/IED",Taliban,,2,"Military Forces of Afghanistan (2014-)",,1,12,"Caucasus and Central Asia",Afghanistan,Badghis,"Ab Kamari",,"Sang Atesh",35.0853,63.0642,2,"Voice of Jihad",Other,"On 19 December 2019, 1 soldier was killed and others were wounded when they were hit by a Taliban-planted landmine in Ab Kamari (Sang Atesh) district, Badghis. fatalities coded as 0 (VoJ reported 1 fatality).",0,1580846886,AFG
6708114,792,TUR10460,10460,"19 December 2019",2019,1,"Explosions/Remote violence","Remote explosive/landmine/IED","PKK: Kurdistan Workers Party",,2,"Military Forces of Turkey (2016-)",,1,12,"Middle East",Turkey,Hakkari,Cukurca,,Cukurca,37.2481,43.6136,2,"Takvim; Karar; Sozcu",National-Regional,"On December 19, One Turkish Soldier was critically wounded by the explosion of an IED planted by PKK in Cukurca district of Hakkari. The soldier later succumbed to his wounds, died in the hospital.",1,1578503874,TUR
6712978,120,CAO2754,2754,"19 December 2019",2019,1,"Violence against civilians",Attack,"Ambazonian Separatists (Cameroon)",,2,"Civilians (Cameroon)","Labour Group (Cameroon)",7,27,"Middle Africa",Cameroon,Sud-Ouest,Kupe-Manenguba,Muyuka,Ekona,5.0288,9.4924,1,"Mimi Mefo; Camer.be; Cameroon News Agency","New media-National","On 19 December 2019, suspected Ambazonian separatists ambushed a transport vehicle belonging to Source du Pays Company (or Supermont Company according to Mimi Mefo report) in Ekona town, Muyuka subdivision (Kupe-Manenguba, Sud-Ouest). 2 workers of the company were killed and 15 others injured (Camer.be reports 5 injuries). One of the injured workers later die of her wounds (Mimi Mefo reports), that makes a total of 3 killed.",3,1578512390,CMR
6713746,450,MAG1451,1451,"19 December 2019",2019,1,Battles,"Armed clash","Soavinandriana Communal Militia (Madagascar)",,4,"Soavinandriana Communal Militia (Madagascar)",,4,44,"Eastern Africa",Madagascar,Itasy,Soavinandriana,,Soavinandriana,-19.1667,46.7333,1,"Midi Madagasikara",National,"On December 19 2019, clashes broke out between community members in Soavinandriana (Itasy) related to a land dispute. 17 people were arrested.",0,1578512392,MDG
6815891,4,AFG42305,42305,"19 December 2019",2019,1,Battles,"Armed clash",Taliban,,2,"Military Forces of Afghanistan (2014-)",,1,12,"Caucasus and Central Asia",Afghanistan,Paktia,Gardez,,Gardez,33.5974,69.2259,1,"Voice of Jihad",Other,"On 19 December 2019, 2 soldiers were killed and 1 was wounded following an attack by Taliban militants in Gardez city, Paktia. fatalities coded as 0 (VoJ reported 2 fatalities).",0,1580846886,AFG
6709139,275,PSE6636,6636,"19 December 2019",2019,1,"Strategic developments","Looting/property destruction","Settlers (Israel)",,3,"Civilians (Palestine)",,7,37,"Middle East",Palestine,"West Bank","Al Quds",,"Al Jib",31.852,35.1845,1,"Times of Israel",Regional,"Property destruction: Overnight on December 19 2019, Israeli Settlers slashed the tyres of 18 Palestinian-owned vehicles in the village of Jib near Jerusalem and spray painted the phrase ""Arabs? Expel or kill!"" on a building in the village.",0,1578503876,PSE
6815892,4,AFG42058,42058,"19 December 2019",2019,1,Battles,"Armed clash",Taliban,,2,"Military Forces of Afghanistan (2014-)",,1,12,"Caucasus and Central Asia",Afghanistan,Nimruz,"Khash Rod",,Khash,31.5292,62.7905,2,"Afghan Ministry of Defense",Other,"As reported on 20 December 2019, over the past 24 hours, 3 suspected Taliban militants were killed and 1 was wounded when Afghan military forces repulsed their attacks in Khash Rod (Delaram) district, Nimruz.",3,1580846886,AFG
